province,hospital_th,hospital_en,h_code,affiliation,hospital_type,beds,specialty_note,health_region
อำนาจเจริญ,โรงพยาบาลพนา,PHANA HOSPITAL,10987,สำนักงานปลัดกระทรวงสาธารณสุข (สป.สธ.),โรงพยาบาลชุมชน(รพช.),30.0,ให้การดูแลรักษาพยาบาลในระดับทุติยภูมิ และให้บริการงานส่'เสริมสุขภาพ ควบคุมป้องกันโรค ฟื้ฟูสภาพ และผสมผสานการจัดบริการด้านการแพทย์แผนไทยแบบคู่ขนาน<br />,10
อำนาจเจริญ,โรงพยาบาลเสนางคนิคม,SENANGKANIKOM HOSPITAL,10988,สำนักงานปลัดกระทรวงสาธารณสุข (สป.สธ.),โรงพยาบาลชุมชน(รพช.),30.0,,10
อำนาจเจริญ,โรงพยาบาลหัวตะพาน,HUATAPHAN HOSPITAL,10989,สำนักงานปลัดกระทรวงสาธารณสุข (สป.สธ.),โรงพยาบาลชุมชน(รพช.),60.0,,10
อำนาจเจริญ,โรงพยาบาลลืออำนาจ,LUE AMNAT HOSPITAL,10990,สำนักงานปลัดกระทรวงสาธารณสุข (สป.สธ.),โรงพยาบาลชุมชน(รพช.),30.0,เป็นโรงพยาบาลชั้นนำในการนำเทคโนโลยีมาพัฒนาระบบบริการด้านสุขภาพ,10
หนองบัวลำภู,โรงพยาบาลนากลาง,NAKLANG HOSPITAL,10991,สำนักงานปลัดกระทรวงสาธารณสุข (สป.สธ.),โรงพยาบาลชุมชน(รพช.),87.0,1.การทำงานกับชุมชนและเครือข่าย 2.ระบบแพทย์ฉุกเฉิน 3.การดูแลโรคเรื้อรัง,8
หนองบัวลำภู,โรงพยาบาลโนนสัง,NONSANG  HOSPITAL,10992,สำนักงานปลัดกระทรวงสาธารณสุข (สป.สธ.),โรงพยาบาลชุมชน(รพช.),30.0,,8
หนองบัวลำภู,โรงพยาบาลศรีบุญเรือง,SRI BOON RUANG HOSPITAL,10993,สำนักงานปลัดกระทรวงสาธารณสุข (สป.สธ.),โรงพยาบาลชุมชน(รพช.),90.0,,8
หนองบัวลำภู,โรงพยาบาลสุวรรณคูหา,SUWANKHUHA HOSPITAL,10994,สำนักงานปลัดกระทรวงสาธารณสุข (สป.สธ.),โรงพยาบาลชุมชน(รพช.),30.0,,8
ขอนแก่น,โรงพยาบาลบ้านฝาง,BAN FANG HOSPITAL,10995,สำนักงานปลัดกระทรวงสาธารณสุข (สป.สธ.),โรงพยาบาลชุมชน(รพช.),42.0,สร้างเสริมสุขภาพ โดยภาคีเครือข่าย,7
ขอนแก่น,โรงพยาบาลพระยืน,PRAYUEN HOSPITAL,10996,สำนักงานปลัดกระทรวงสาธารณสุข (สป.สธ.),โรงพยาบาลชุมชน(รพช.),30.0,,7
ขอนแก่น,โรงพยาบาลหนองเรือ,NONG RUEA HOSPITAL,10997,สำนักงานปลัดกระทรวงสาธารณสุข (สป.สธ.),โรงพยาบาลชุมชน(รพช.),90.0,,7
ขอนแก่น,โรงพยาบาลชุมแพ,CHUMPHAE HOSPITAL,10998,สำนักงานปลัดกระทรวงสาธารณสุข (สป.สธ.),โรงพยาบาลทั่วไป(รพท.),350.0,ให้การดูแลรักษาผู้ป่วยที่มีความซับซ้อนแบบบูรณาการ,7
ขอนแก่น,โรงพยาบาลสีชมพู,SICHOMPHU HOSPITAL,10999,สำนักงานปลัดกระทรวงสาธารณสุข (สป.สธ.),โรงพยาบาลชุมชน(รพช.),65.0,ระบบบริการปฐมภูมิให้การดูแลแบบองค์รวมร่วมกับภาคีเครือข่าย การดูแลผู้ป่วยระยะกลาง [IMC : Stroke TBI SCI]  และจิตเวชเครือข่าย,7
ขอนแก่น,โรงพยาบาลน้ำพอง,NAMPHONG HOSPITAL,11000,สำนักงานปลัดกระทรวงสาธารณสุข (สป.สธ.),โรงพยาบาลชุมชน(รพช.),200.0,สร้างเครือข่ายการทำงานเพื่อคุณภาพชีวิตประชาชน,7
ขอนแก่น,โรงพยาบาลอุบลรัตน์,UBOLRATTANA HOSPITAL,11001,สำนักงานปลัดกระทรวงสาธารณสุข (สป.สธ.),โรงพยาบาลชุมชน(รพช.),60.0,,7
ขอนแก่น,โรงพยาบาลบ้านไผ่,BANPHAI HOSPITAL,11002,สำนักงานปลัดกระทรวงสาธารณสุข (สป.สธ.),โรงพยาบาลชุมชน(รพช.),121.0,1. LC  2.colonoscopy,7
ขอนแก่น,โรงพยาบาลเปือยน้อย,PUAINOI HOSPITAL,11003,สำนักงานปลัดกระทรวงสาธารณสุข (สป.สธ.),โรงพยาบาลชุมชน(รพช.),30.0,,7
ขอนแก่น,โรงพยาบาลพล,PHON HOSPITAL,11004,สำนักงานปลัดกระทรวงสาธารณสุข (สป.สธ.),โรงพยาบาลชุมชน(รพช.),67.0,,7
ขอนแก่น,โรงพยาบาลแวงใหญ่,WAENGYAI HOSPITAL,11005,สำนักงานปลัดกระทรวงสาธารณสุข (สป.สธ.),โรงพยาบาลชุมชน(รพช.),36.0,,7
ขอนแก่น,โรงพยาบาลแวงน้อย,WAENGNOI HOSPITAL,11006,สำนักงานปลัดกระทรวงสาธารณสุข (สป.สธ.),โรงพยาบาลชุมชน(รพช.),34.0,ให้บริการส่งเสริมสุขภาพ ป้องกันโรค รักษาพยาบาลและฟื้นฟูสภาพแบบองค์รวม โดยการมีส่วนร่วมของเครือข่าย,7
ขอนแก่น,โรงพยาบาลหนองสองห้อง,NONGSONGHONG HOSPITAL,11007,สำนักงานปลัดกระทรวงสาธารณสุข (สป.สธ.),โรงพยาบาลชุมชน(รพช.),65.0,,7
ขอนแก่น,โรงพยาบาลภูเวียง,PHUWIANG HOSPITAL,11008,สำนักงานปลัดกระทรวงสาธารณสุข (สป.สธ.),โรงพยาบาลชุมชน(รพช.),98.0,,7
ขอนแก่น,โรงพยาบาลมัญจาคีรี,MANCHAKIRI HOSPITAL,11009,สำนักงานปลัดกระทรวงสาธารณสุข (สป.สธ.),โรงพยาบาลชุมชน(รพช.),74.0,,7
ขอนแก่น,โรงพยาบาลชนบท,CHONNABOT HOSPITAL,11010,สำนักงานปลัดกระทรวงสาธารณสุข (สป.สธ.),โรงพยาบาลชุมชน(รพช.),30.0,,7
ขอนแก่น,โรงพยาบาลเขาสวนกวาง,KHAOSUANKWANG HOSPITAL,11011,สำนักงานปลัดกระทรวงสาธารณสุข (สป.สธ.),โรงพยาบาลชุมชน(รพช.),45.0,,7
ขอนแก่น,โรงพยาบาลภูผาม่าน,PHUPHAMAN HOSPITAL,11012,สำนักงานปลัดกระทรวงสาธารณสุข (สป.สธ.),โรงพยาบาลชุมชน(รพช.),30.0,,7
อุดรธานี,โรงพยาบาลกุดจับ,KUTCHAP HOSPITAL,11013,สำนักงานปลัดกระทรวงสาธารณสุข (สป.สธ.),โรงพยาบาลชุมชน(รพช.),70.0,,8
อุดรธานี,โรงพยาบาลหนองวัวซอ,NONGWUASAW HOSPITAL ,11014,สำนักงานปลัดกระทรวงสาธารณสุข (สป.สธ.),โรงพยาบาลชุมชน(รพช.),60.0,เป็นโรงพยาบาลชุมชนระดับทุตติยภูมิขนาด 2.1 ที่ให้บริการ ตรวจรักษาโรค ส่งเสริม ป้องกันและฟื้นฟูสภาพ ประชาชนในเขตอำเภอหนองวัวซอ และพื้นที่ใกล้เคียง และบริการผู้ป่วยฉุกเฉินและคลอดตลอด 24 ชั่วโมง,8
อุดรธานี,โรงพยาบาลกุมภวาปี,KUMPHAWAPI HOSPITAL,11015,สำนักงานปลัดกระทรวงสาธารณสุข (สป.สธ.),โรงพยาบาลทั่วไป(รพท.),180.0,,8
อุดรธานี,โรงพยาบาลห้วยเกิ้ง,Huaykoeng HOSPITAL,11016,สำนักงานปลัดกระทรวงสาธารณสุข (สป.สธ.),โรงพยาบาลชุมชน(รพช.),10.0,,8
อุดรธานี,โรงพยาบาลโนนสะอาด,NONSAAD HOSPITAL,11017,สำนักงานปลัดกระทรวงสาธารณสุข (สป.สธ.),โรงพยาบาลชุมชน(รพช.),40.0,,8
อุดรธานี,โรงพยาบาลหนองหาน,NONGHAN HOSPITAL,11018,สำนักงานปลัดกระทรวงสาธารณสุข (สป.สธ.),โรงพยาบาลชุมชน(รพช.),110.0,,8
อุดรธานี,โรงพยาบาลทุ่งฝน,THUNGFON HOSPITAL,11019,สำนักงานปลัดกระทรวงสาธารณสุข (สป.สธ.),โรงพยาบาลชุมชน(รพช.),30.0,,8
อุดรธานี,โรงพยาบาลไชยวาน,CHAIWAN HOSPITAL,11020,สำนักงานปลัดกระทรวงสาธารณสุข (สป.สธ.),โรงพยาบาลชุมชน(รพช.),30.0,,8
อุดรธานี,โรงพยาบาลศรีธาตุ,SRITHAT HOSPITAL,11021,สำนักงานปลัดกระทรวงสาธารณสุข (สป.สธ.),โรงพยาบาลชุมชน(รพช.),0.0,,8
อุดรธานี,โรงพยาบาลวังสามหมอ,WANGSAMMO HOSPITAL,11022,สำนักงานปลัดกระทรวงสาธารณสุข (สป.สธ.),โรงพยาบาลชุมชน(รพช.),40.0,,8
อุดรธานี,โรงพยาบาลบ้านผือ,BANPHUE HOSPITAL,11023,สำนักงานปลัดกระทรวงสาธารณสุข (สป.สธ.),โรงพยาบาลชุมชน(รพช.),90.0,,8
อุดรธานี,โรงพยาบาลน้ำโสม,NAMSOM HOSPITAL,11024,สำนักงานปลัดกระทรวงสาธารณสุข (สป.สธ.),โรงพยาบาลชุมชน(รพช.),70.0,,8
อุดรธานี,โรงพยาบาลเพ็ญ,PHEN HOSPITAL,11025,สำนักงานปลัดกระทรวงสาธารณสุข (สป.สธ.),โรงพยาบาลชุมชน(รพช.),114.0,ให้การดูแลรักษาเฉพาะทางด้านอายุรกรรม ศัลยกรรม กุมารกรรม สูติ-นรีเวชกรรม ทัตกรรม แพทย์แผนไทย แพทย์ทางเลือก การส่งเสริม ป้องกัน  ฟื้นฟูโรคในพื้นที่อำเภอเพ็ญ คลอบคลุมโรคเรื้อรัง โรคและภัยสุขภาพที่สำคัญในพื้นที่ ป้องกันควบคุมไม่ให้เกิดโรคระบาดหรือระบาดซ้ำในพื้นที่ รับผู้ป่วยสำหรับดูแลแบบ Intermediate Care เตรียมผู้ป่วยและญาติให้พร้อมสำหรับการดูแลตนเองที่บ้านและในชุมชน ส่งต่อในโรคที่ซับซ้อนหรือมีข้อจำกัดในการดูแลรักษาสู่โรงพยาบาลที่มีศักยภาพสูงกว่า<br />,8
อุดรธานี,โรงพยาบาลสร้างคอม,SANHKHOM HOSPITAL,11026,สำนักงานปลัดกระทรวงสาธารณสุข (สป.สธ.),โรงพยาบาลชุมชน(รพช.),30.0,,8
อุดรธานี,โรงพยาบาลหนองแสง,NONGSAENG HOSPITAL,11027,สำนักงานปลัดกระทรวงสาธารณสุข (สป.สธ.),โรงพยาบาลชุมชน(รพช.),30.0,-	การคัดกรองและประเมินอาการผู้ป่วยกลุ่มโรคสำคัญ ได้แก่ Stroke STEMI Sepsis <br />-	การควบคุมการแพร่กระจายเชื้อและการดูแลผู้ป่วย COVID-19 TB <br />-	การให้ความรู้เรื่องยากลุ่มโรค DM HT CKD COVID-19 ผู้ป่วยที่รับยา Warfarin การให้ความรู้การเสริมพลังในการดูแลสุขภาพตนเองผู้ป่วยโรคสำคัญ ได้แก่ DM <br />-	การส่งตรวจทางห้องปฏิบัติการ ได้แก่ การรายงานค่าวิกฤติผู้ป่วยโรคเบาหวาน การส่งสิ่งตรวจทางห้องปฏิบัติการโรค COVID-19  ,8
อุดรธานี,โรงพยาบาลนายูง,NAYOONG HOSPITAL,11028,สำนักงานปลัดกระทรวงสาธารณสุข (สป.สธ.),โรงพยาบาลชุมชน(รพช.),30.0,ทดสอบ,8
อุดรธานี,โรงพยาบาลพิบูลย์รักษ์,PHIBUNRAK HOSPITAL,11029,สำนักงานปลัดกระทรวงสาธารณสุข (สป.สธ.),โรงพยาบาลชุมชน(รพช.),30.0,1.การรักษาพยาบาลโรคทั่วไป  <br />2.การส่งเสริมสุขภาพประชาชน<br />3.การควบคุม ป้องกันโรค<br />4.การฟื้นฟูสภาพ,8
เลย,โรงพยาบาลนาด้วง,NADUANG HOSPITAL,11030,สำนักงานปลัดกระทรวงสาธารณสุข (สป.สธ.),โรงพยาบาลชุมชน(รพช.),42.0,,8
เลย,โรงพยาบาลเชียงคาน,CHIANGKHAN HOSPITAL,11031,สำนักงานปลัดกระทรวงสาธารณสุข (สป.สธ.),โรงพยาบาลชุมชน(รพช.),60.0,ภาคีเครือข่ายมีส่วนร่วมในการดูแลสุขภาพประชาชนในพื้นที่ ,8
เลย,โรงพยาบาลปากชม,PAKCHOM HOSPITAL,11032,สำนักงานปลัดกระทรวงสาธารณสุข (สป.สธ.),โรงพยาบาลชุมชน(รพช.),30.0,0,8
เลย,โรงพยาบาลนาแห้ว,NAHAEO HOSPITAL,11033,สำนักงานปลัดกระทรวงสาธารณสุข (สป.สธ.),โรงพยาบาลชุมชน(รพช.),30.0,,8
เลย,โรงพยาบาลภูเรือ,PHURUA HOSPITAL,11034,สำนักงานปลัดกระทรวงสาธารณสุข (สป.สธ.),โรงพยาบาลชุมชน(รพช.),30.0,,8
เลย,โรงพยาบาลท่าลี่,THALI HOSPITAL,11035,สำนักงานปลัดกระทรวงสาธารณสุข (สป.สธ.),โรงพยาบาลชุมชน(รพช.),30.0,,8
เลย,โรงพยาบาลวังสะพุง,WANGSAPHUNG HOSPITAL,11036,สำนักงานปลัดกระทรวงสาธารณสุข (สป.สธ.),โรงพยาบาลชุมชน(รพช.),113.0,1. สาขาอายุรกรรม<br />2.สาขาศัลยกรรม<br />3.สาขากุมารเวชกรรม<br />4.สาขาสูตินรีเวชกรรม<br />5.สาขาวิสัญญี<br />6.สาขาทันตกรรมทั่วไป/เฉพาะทางทันตกรรม 4 สาขา,8
เลย,โรงพยาบาลภูกระดึง,PHUKRADUENG HOSPITAL,11037,สำนักงานปลัดกระทรวงสาธารณสุข (สป.สธ.),โรงพยาบาลชุมชน(รพช.),51.0,,8
เลย,โรงพยาบาลภูหลวง,PHULUANG HOSPITAL,11038,สำนักงานปลัดกระทรวงสาธารณสุข (สป.สธ.),โรงพยาบาลชุมชน(รพช.),30.0,,8
เลย,โรงพยาบาลผาขาว,PHAKHAO HOSPITAL,11039,สำนักงานปลัดกระทรวงสาธารณสุข (สป.สธ.),โรงพยาบาลชุมชน(รพช.),30.0,,8
บึงกาฬ,โรงพยาบาลบึงกาฬ,BUENGKAN HOSPITAL,11040,สำนักงานปลัดกระทรวงสาธารณสุข (สป.สธ.),โรงพยาบาลทั่วไป(รพท.),295.0,,8
บึงกาฬ,โรงพยาบาลพรเจริญ,PORNCHAROEN HOSPITAL,11041,สำนักงานปลัดกระทรวงสาธารณสุข (สป.สธ.),โรงพยาบาลชุมชน(รพช.),47.0,ทดสอบ,8
หนองคาย,โรงพยาบาลโพนพิสัย,PHONPHISAI HOSPITAL,11042,สำนักงานปลัดกระทรวงสาธารณสุข (สป.สธ.),โรงพยาบาลชุมชน(รพช.),109.0,,8
บึงกาฬ,โรงพยาบาลโซ่พิสัย,SOPHISAI HOSPITAL,11043,สำนักงานปลัดกระทรวงสาธารณสุข (สป.สธ.),โรงพยาบาลชุมชน(รพช.),55.0,,8
หนองคาย,โรงพยาบาลศรีเชียงใหม่,SRICHIANGMAI  HOSPITAL,11044,สำนักงานปลัดกระทรวงสาธารณสุข (สป.สธ.),โรงพยาบาลชุมชน(รพช.),35.0,,8
หนองคาย,โรงพยาบาลสังคม,SANGKHOM HOSPITAL,11045,สำนักงานปลัดกระทรวงสาธารณสุข (สป.สธ.),โรงพยาบาลชุมชน(รพช.),40.0,,8
บึงกาฬ,โรงพยาบาลเซกา,SEKA HOSPITAL,11046,สำนักงานปลัดกระทรวงสาธารณสุข (สป.สธ.),โรงพยาบาลชุมชน(รพช.),123.0,,8
บึงกาฬ,โรงพยาบาลปากคาด,PAKKAT HOSPITAL,11047,สำนักงานปลัดกระทรวงสาธารณสุข (สป.สธ.),โรงพยาบาลชุมชน(รพช.),37.0,1.ดูแลรักษาโรคทั่วไป ตามศักยภาพของ รพ.ระดับ F2<br />2.ส่งเสริมสุขภาพประชากรตามกลุ่มวัย<br />3.ด้านการส่งต่อกลุ่มผู้ป่วย fast track,8
บึงกาฬ,โรงพยาบาลบึงโขงหลง,BUENGKHONGLONG HOSPITAL,11048,สำนักงานปลัดกระทรวงสาธารณสุข (สป.สธ.),โรงพยาบาลชุมชน(รพช.),58.0,,8
บึงกาฬ,โรงพยาบาลศรีวิไล,SRIWILAI HOSPITAL,11049,สำนักงานปลัดกระทรวงสาธารณสุข (สป.สธ.),โรงพยาบาลชุมชน(รพช.),38.0,ทดสอบ,8
บึงกาฬ,โรงพยาบาลบุ่งคล้า,BUNGKLA HOSPITAL,11050,สำนักงานปลัดกระทรวงสาธารณสุข (สป.สธ.),โรงพยาบาลชุมชน(รพช.),32.0,บริการครอบคลุม 4 มิติ และการสร้างเครือข่ายความร่วมมือกับชุมชน,8
มหาสารคาม,โรงพยาบาลแกดำ,KAEDAM HOSPITAL,11051,สำนักงานปลัดกระทรวงสาธารณสุข (สป.สธ.),โรงพยาบาลชุมชน(รพช.),36.0,1)เชี่ยวชาญการบริการปฐมภูมิ ให้การดูแลแบบองค์รวมร่วมกับภาคีเครือข่ายสุขภาพ 2)มีวัฒนธรรมความปลอดภัยทั้งองค์กร ,7
มหาสารคาม,โรงพยาบาลโกสุมพิสัย,KOSUMPISAI HOSPITAL,11052,สำนักงานปลัดกระทรวงสาธารณสุข (สป.สธ.),โรงพยาบาลชุมชน(รพช.),128.0,,7
มหาสารคาม,โรงพยาบาลกันทรวิชัย,KANTARAWICHAI HOSPITAL,11053,สำนักงานปลัดกระทรวงสาธารณสุข (สป.สธ.),โรงพยาบาลชุมชน(รพช.),68.0,,7
มหาสารคาม,โรงพยาบาลเชียงยืน,CHIANG YUEN HOSPITAL,11054,สำนักงานปลัดกระทรวงสาธารณสุข (สป.สธ.),โรงพยาบาลชุมชน(รพช.),60.0,การมีส่วนร่วมของภาคีเครือข่ายและชุมชนในการพัฒนาระบบบริการ ,7
มหาสารคาม,โรงพยาบาลบรบือ,BORABUE HOSPITAL,11055,สำนักงานปลัดกระทรวงสาธารณสุข (สป.สธ.),โรงพยาบาลชุมชน(รพช.),114.0,,7
มหาสารคาม,โรงพยาบาลนาเชือก,NACHAUK HOSPITAL,11056,สำนักงานปลัดกระทรวงสาธารณสุข (สป.สธ.),โรงพยาบาลชุมชน(รพช.),36.0,,7
