province,hospital_th,hospital_en,h_code,affiliation,hospital_type,beds,specialty_note,health_region
นครศรีธรรมราช,โรงพยาบาลร่อนพิบูลย์,RONPHIBUN HOSPITAL,11334,สำนักงานปลัดกระทรวงสาธารณสุข (สป.สธ.),โรงพยาบาลชุมชน(รพช.),0.0,,11
นครศรีธรรมราช,โรงพยาบาลสิชล,SICHON HOSPITAL,11335,สำนักงานปลัดกระทรวงสาธารณสุข (สป.สธ.),โรงพยาบาลทั่วไป(รพท.),260.0,,11
นครศรีธรรมราช,โรงพยาบาลขนอม,KHANOM HOSPITAL,11336,สำนักงานปลัดกระทรวงสาธารณสุข (สป.สธ.),โรงพยาบาลชุมชน(รพช.),67.0,Paliative care,11
นครศรีธรรมราช,โรงพยาบาลหัวไทร,HUASAI HOSPITAL,11337,สำนักงานปลัดกระทรวงสาธารณสุข (สป.สธ.),โรงพยาบาลชุมชน(รพช.),60.0,ทดสอบ,11
นครศรีธรรมราช,โรงพยาบาลบางขัน,BANGKHAN HOSPITAL,11338,สำนักงานปลัดกระทรวงสาธารณสุข (สป.สธ.),โรงพยาบาลชุมชน(รพช.),30.0,,11
นครศรีธรรมราช,โรงพยาบาลถ้ำพรรณรา,THAMPUNNARA HOSPITAL,11339,สำนักงานปลัดกระทรวงสาธารณสุข (สป.สธ.),โรงพยาบาลชุมชน(รพช.),15.0,,11
กระบี่,โรงพยาบาลเขาพนม,KAOPANOM HOSPITAL,11340,สำนักงานปลัดกระทรวงสาธารณสุข (สป.สธ.),โรงพยาบาลชุมชน(รพช.),45.0,การสร้างความร่วมมือกับทุกภาคส่วนและภาคีเครือข่าย,11
กระบี่,โรงพยาบาลเกาะลันตา,KOHLANTA HOSPITAL,11341,สำนักงานปลัดกระทรวงสาธารณสุข (สป.สธ.),โรงพยาบาลชุมชน(รพช.),23.0,,11
กระบี่,โรงพยาบาลคลองท่อม,KLONGTHOM HOSPITAL,11342,สำนักงานปลัดกระทรวงสาธารณสุข (สป.สธ.),โรงพยาบาลชุมชน(รพช.),84.0,,11
กระบี่,โรงพยาบาลอ่าวลึก,AOLUK HOSPITAL,11343,สำนักงานปลัดกระทรวงสาธารณสุข (สป.สธ.),โรงพยาบาลชุมชน(รพช.),60.0,การดูแลผู้ป่วยแบบเครือข่าย,11
กระบี่,โรงพยาบาลปลายพระยา,PLAIPRAYA HOSPITAL,11344,สำนักงานปลัดกระทรวงสาธารณสุข (สป.สธ.),โรงพยาบาลชุมชน(รพช.),30.0,,11
กระบี่,โรงพยาบาลลำทับ,LAMTHAP HOSPITAL,11345,สำนักงานปลัดกระทรวงสาธารณสุข (สป.สธ.),โรงพยาบาลชุมชน(รพช.),30.0,,11
กระบี่,โรงพยาบาลเหนือคลอง,NUEKLONG HOSPITAL,11346,สำนักงานปลัดกระทรวงสาธารณสุข (สป.สธ.),โรงพยาบาลชุมชน(รพช.),40.0,,11
พังงา,โรงพยาบาลเกาะยาวชัยพัฒน์,KOHYAOCHAIPAT  HOSPITAL,11347,สำนักงานปลัดกระทรวงสาธารณสุข (สป.สธ.),โรงพยาบาลชุมชน(รพช.),30.0,,11
พังงา,โรงพยาบาลกะปงชัยพัฒน์,KAPONGCHAIPAT HOSPITAL,11348,สำนักงานปลัดกระทรวงสาธารณสุข (สป.สธ.),โรงพยาบาลชุมชน(รพช.),30.0,,11
พังงา,โรงพยาบาลตะกั่วทุ่ง,TAKUATUNG HOSPITAL,11349,สำนักงานปลัดกระทรวงสาธารณสุข (สป.สธ.),โรงพยาบาลชุมชน(รพช.),30.0,,11
พังงา,โรงพยาบาลบางไทร,BANGSAI HOSPITAL,11350,สำนักงานปลัดกระทรวงสาธารณสุข (สป.สธ.),โรงพยาบาลชุมชน(รพช.),0.0,,11
พังงา,โรงพยาบาลคุระบุรีชัยพัฒน์,KURABURICHAIPAT  HOSPITAL,11352,สำนักงานปลัดกระทรวงสาธารณสุข (สป.สธ.),โรงพยาบาลชุมชน(รพช.),32.0,,11
พังงา,โรงพยาบาลทับปุด,THAPPUT HOSPITAL,11353,สำนักงานปลัดกระทรวงสาธารณสุข (สป.สธ.),โรงพยาบาลชุมชน(รพช.),30.0,,11
พังงา,โรงพยาบาลท้ายเหมืองชัยพัฒน์,THAIMUANGCHAIPAT HOSPITAL,11354,สำนักงานปลัดกระทรวงสาธารณสุข (สป.สธ.),โรงพยาบาลชุมชน(รพช.),30.0,,11
ภูเก็ต,โรงพยาบาลป่าตอง,PATONG HOSPITAL,11355,สำนักงานปลัดกระทรวงสาธารณสุข (สป.สธ.),โรงพยาบาลชุมชน(รพช.),60.0,,11
ภูเก็ต,โรงพยาบาลถลาง,THALANG HOSPITAL,11356,สำนักงานปลัดกระทรวงสาธารณสุข (สป.สธ.),โรงพยาบาลชุมชน(รพช.),72.0,,11
สุราษฎร์ธานี,โรงพยาบาลกาญจนดิษฐ์,KANCHANADIT HOSPITAL,11357,สำนักงานปลัดกระทรวงสาธารณสุข (สป.สธ.),โรงพยาบาลชุมชน(รพช.),148.0,โรงพยาบาลกาญจนดิษฐ์มีความเชี่ยวชาญพิเศษขององค์กรในการดูแลผู้ป่วยเฉพาะทาง 6 สาขาประกอบด้วย<br />1. สาขาสูติกรรม มีความเชี่ยวชาญด้านการดูแลมารดาและทารกแรกเกิด<br />2. สาขาอายุรกรรม มีความเชี่ยวชาญด้านการดูแลผู้ป่วยวิกฤติทางอายุรกรรม<br />3. สาขากุมารเวชกรรม มีความเชี่ยวชาญด้านการดูแลผู้ป่วยเด็กไข้เลือดออก<br />4. สาขาศัลยกรรม มีความเชี่ยวชาญด้านการคัดกรองโรคมะเร็งลำไส้และการผ่าตัดส่องกล้อง<br />5. สาขาศัลยกรรมกระดูก มีความเชี่ยวชาญด้านการรักษาผู้ป่วยกระดูกหักและข้อเคลื่อน<br />6. สาขาทันตกรรม มีความเชี่ยวชาญด้านการดูแลผู้ป่วยทันตกรรมเฉพาะทางในสาขา      <br />ทันตกรรมรักษาคลองรากฟัน ทันตกรรมสำหรับเด็ก ทันตกรรมประดิษฐ์ และศัลยศาสตร์ช่องปาก<br />,11
สุราษฎร์ธานี,โรงพยาบาลดอนสัก,DONSAK HOSPITAL,11358,สำนักงานปลัดกระทรวงสาธารณสุข (สป.สธ.),โรงพยาบาลชุมชน(รพช.),37.0,,11
สุราษฎร์ธานี,โรงพยาบาลเกาะพะงัน,KOH PHANGAN HOSPITAL,11359,สำนักงานปลัดกระทรวงสาธารณสุข (สป.สธ.),โรงพยาบาลชุมชน(รพช.),30.0,,11
สุราษฎร์ธานี,โรงพยาบาลไชยา,CHAIYA HOSPITAL,11360,สำนักงานปลัดกระทรวงสาธารณสุข (สป.สธ.),โรงพยาบาลชุมชน(รพช.),60.0,,11
สุราษฎร์ธานี,โรงพยาบาลท่าชนะ,THACHANA HOSPITAL,11361,สำนักงานปลัดกระทรวงสาธารณสุข (สป.สธ.),โรงพยาบาลชุมชน(รพช.),30.0,,11
สุราษฎร์ธานี,โรงพยาบาลคีรีรัฐนิคม,KIRERATNIKOM  HOSPITAL,11362,สำนักงานปลัดกระทรวงสาธารณสุข (สป.สธ.),โรงพยาบาลชุมชน(รพช.),30.0,,11
สุราษฎร์ธานี,โรงพยาบาลบ้านตาขุน,BANTAKHUN HOSPITAL,11363,สำนักงานปลัดกระทรวงสาธารณสุข (สป.สธ.),โรงพยาบาลชุมชน(รพช.),42.0,,11
สุราษฎร์ธานี,โรงพยาบาลพนม,PHANOM HOSPITAL,11364,สำนักงานปลัดกระทรวงสาธารณสุข (สป.สธ.),โรงพยาบาลชุมชน(รพช.),40.0,,11
สุราษฎร์ธานี,โรงพยาบาลท่าฉาง,THACHANG HOSPITAL,11365,สำนักงานปลัดกระทรวงสาธารณสุข (สป.สธ.),โรงพยาบาลชุมชน(รพช.),34.0,,11
สุราษฎร์ธานี,โรงพยาบาลบ้านนาสาร,BANNASAN  HOSPITAL,11366,สำนักงานปลัดกระทรวงสาธารณสุข (สป.สธ.),โรงพยาบาลชุมชน(รพช.),0.0,,11
สุราษฎร์ธานี,โรงพยาบาลบ้านนาเดิม,BANNADOEM HOSPITAL,11367,สำนักงานปลัดกระทรวงสาธารณสุข (สป.สธ.),โรงพยาบาลชุมชน(รพช.),30.0,,11
สุราษฎร์ธานี,โรงพยาบาลเคียนซา,KHIENSA HOSPITAL,11368,สำนักงานปลัดกระทรวงสาธารณสุข (สป.สธ.),โรงพยาบาลชุมชน(รพช.),49.0,,11
สุราษฎร์ธานี,โรงพยาบาลพระแสง,PHRASEANG HOSPITAL,11369,สำนักงานปลัดกระทรวงสาธารณสุข (สป.สธ.),โรงพยาบาลชุมชน(รพช.),30.0,,11
สุราษฎร์ธานี,โรงพยาบาลพุนพิน,PHUNPHIN HOSPITAL,11370,สำนักงานปลัดกระทรวงสาธารณสุข (สป.สธ.),โรงพยาบาลชุมชน(รพช.),83.0,ทดสอบ,11
สุราษฎร์ธานี,โรงพยาบาลชัยบุรี,CHAIBURI HOSPITAL,11371,สำนักงานปลัดกระทรวงสาธารณสุข (สป.สธ.),โรงพยาบาลชุมชน(รพช.),30.0,ทดสอบ,11
ระนอง,โรงพยาบาลกะเปอร์,KAPOE HOSPITAL,11372,สำนักงานปลัดกระทรวงสาธารณสุข (สป.สธ.),โรงพยาบาลชุมชน(รพช.),30.0,การบริการส่งเสริม ป้องกัน รักษา การฟื้นฟูสภาพ และการบริการสุขภาพเชิงรุกในชุมชน,11
ระนอง,โรงพยาบาลกระบุรี,KRABURI HOSPITAL,11373,สำนักงานปลัดกระทรวงสาธารณสุข (สป.สธ.),โรงพยาบาลชุมชน(รพช.),52.0,ความพร้อมในการรับมืออุบัติเหตุ,11
ระนอง,โรงพยาบาลสุขสำราญ,SUKSAMRAN HOSPITAL,11374,สำนักงานปลัดกระทรวงสาธารณสุข (สป.สธ.),โรงพยาบาลชุมชน(รพช.),24.0,,11
ชุมพร,โรงพยาบาลปากน้ำชุมพร,PAKNAMCHUMPHON HOSPITAL,11375,สำนักงานปลัดกระทรวงสาธารณสุข (สป.สธ.),โรงพยาบาลชุมชน(รพช.),16.0,,11
ชุมพร,โรงพยาบาลท่าแซะ,THASAE HOSPITAL,11376,สำนักงานปลัดกระทรวงสาธารณสุข (สป.สธ.),โรงพยาบาลชุมชน(รพช.),48.0,,11
ชุมพร,โรงพยาบาลปะทิว,PPATHIU HOSPITAL,11377,สำนักงานปลัดกระทรวงสาธารณสุข (สป.สธ.),โรงพยาบาลชุมชน(รพช.),47.0,,11
ชุมพร,โรงพยาบาลมาบอำมฤต,MAPAMARIT HOSPITAL,11378,สำนักงานปลัดกระทรวงสาธารณสุข (สป.สธ.),โรงพยาบาลชุมชน(รพช.),30.0,,11
ชุมพร,โรงพยาบาลหลังสวน,LANGSUAN HOSPITAL,11379,สำนักงานปลัดกระทรวงสาธารณสุข (สป.สธ.),โรงพยาบาลชุมชน(รพช.),167.0,,11
ชุมพร,โรงพยาบาลปากน้ำหลังสวน,PAKNAMLANGSUAN HOSPITAL,11380,สำนักงานปลัดกระทรวงสาธารณสุข (สป.สธ.),โรงพยาบาลชุมชน(รพช.),18.0,1. การดูแลผู้ป่วยโรคเรื้อรังแบบองค์รวม<br /> 2. เครือข่ายสุขภาพเข้มแข็ง,11
ชุมพร,โรงพยาบาลละแม,LAMAE HOSPITAL,11381,สำนักงานปลัดกระทรวงสาธารณสุข (สป.สธ.),โรงพยาบาลชุมชน(รพช.),0.0,ทดสอบ,11
ชุมพร,โรงพยาบาลพะโต๊ะ,PHATO HOSPITAL,11382,สำนักงานปลัดกระทรวงสาธารณสุข (สป.สธ.),โรงพยาบาลชุมชน(รพช.),0.0,,11
ชุมพร,โรงพยาบาลสวี,SAWEE HOSPITAL,11383,สำนักงานปลัดกระทรวงสาธารณสุข (สป.สธ.),โรงพยาบาลชุมชน(รพช.),62.0,,11
ชุมพร,โรงพยาบาลทุ่งตะโก,THUNGTAGO  HOSPITAL,11385,สำนักงานปลัดกระทรวงสาธารณสุข (สป.สธ.),โรงพยาบาลชุมชน(รพช.),30.0,,11
สงขลา,โรงพยาบาลสทิงพระ,SATHINGPRA  HOSPITAL,11386,สำนักงานปลัดกระทรวงสาธารณสุข (สป.สธ.),โรงพยาบาลชุมชน(รพช.),30.0,,12
สงขลา,โรงพยาบาลจะนะ,CHANA HOSPITAL,11387,สำนักงานปลัดกระทรวงสาธารณสุข (สป.สธ.),โรงพยาบาลชุมชน(รพช.),64.0,1.การบริหารจัดการการดูแลผู้ป่วย Covid 19<br />2.การดูแลผู้ป่วยแบบต่อเนื่องร่วมกับชุมชน( IMC LTC),12
สงขลา,โรงพยาบาลสมเด็จพระบรมราชินีนาถ ณ อำเภอนาทวี,SOMDEJPRABOROMRACHINEENART NATAWEE HOSPITAL,11388,สำนักงานปลัดกระทรวงสาธารณสุข (สป.สธ.),โรงพยาบาลชุมชน(รพช.),90.0,,12
สงขลา,โรงพยาบาลเทพา,THEPHA HOSPITAL,11390,สำนักงานปลัดกระทรวงสาธารณสุข (สป.สธ.),โรงพยาบาลชุมชน(รพช.),60.0,เวชกรรมทั่วไป รวมการส่งเสริมสุขภาพ การป้องกันโรค และการฟื้นฟูสภาพ ดูแลผู้ป่วยโรคเรื้อรัง 4 มิติ โดยใช้ระบบสุขภาพชุมชน ,12
สงขลา,โรงพยาบาลสะบ้าย้อย,SABAYOI HOSPITAL,11391,สำนักงานปลัดกระทรวงสาธารณสุข (สป.สธ.),โรงพยาบาลชุมชน(รพช.),45.0, 1.  Smart refer 2. การดูแลผู้สูงอายุ (LTC),12
สงขลา,โรงพยาบาลระโนด,RANOD HOSPITAL,11392,สำนักงานปลัดกระทรวงสาธารณสุข (สป.สธ.),โรงพยาบาลชุมชน(รพช.),60.0,,12
สงขลา,โรงพยาบาลกระแสสินธุ์,KRASAESIN HOSPITAL,11393,สำนักงานปลัดกระทรวงสาธารณสุข (สป.สธ.),โรงพยาบาลชุมชน(รพช.),30.0,,12
สงขลา,โรงพยาบาลรัตภูมิ,RATTAPHUM HOSPITAL,11394,สำนักงานปลัดกระทรวงสาธารณสุข (สป.สธ.),โรงพยาบาลชุมชน(รพช.),60.0,,12
สงขลา,โรงพยาบาลสะเดา,SADAO HOSPITAL,11395,สำนักงานปลัดกระทรวงสาธารณสุข (สป.สธ.),โรงพยาบาลชุมชน(รพช.),60.0,,12
สงขลา,โรงพยาบาลนาหม่อม,NAMOM HOSPITAL,11396,สำนักงานปลัดกระทรวงสาธารณสุข (สป.สธ.),โรงพยาบาลชุมชน(รพช.),30.0,,12
สงขลา,โรงพยาบาลควนเนียง,KHUANNIANG HOSPITAL,11397,สำนักงานปลัดกระทรวงสาธารณสุข (สป.สธ.),โรงพยาบาลชุมชน(รพช.),30.0,,12
สงขลา,โรงพยาบาลปาดังเบซาร์,PADANGBESAR HOSPITAL,11398,สำนักงานปลัดกระทรวงสาธารณสุข (สป.สธ.),โรงพยาบาลชุมชน(รพช.),30.0,ดูแลรักษาผู้ป่วยโรคเอดส์,12
สงขลา,โรงพยาบาลบางกล่ำ,BANGKLAM HOSPITAL,11399,สำนักงานปลัดกระทรวงสาธารณสุข (สป.สธ.),โรงพยาบาลชุมชน(รพช.),30.0,,12
สงขลา,โรงพยาบาลสิงหนคร,SINGHANAKORN HOSPITAL,11400,สำนักงานปลัดกระทรวงสาธารณสุข (สป.สธ.),โรงพยาบาลชุมชน(รพช.),30.0,,12
สงขลา,โรงพยาบาลคลองหอยโข่ง (ยุวสมาคมแห่งประเทศไทย),KLONG HOY KONG HOSPITAL,11401,สำนักงานปลัดกระทรวงสาธารณสุข (สป.สธ.),โรงพยาบาลชุมชน(รพช.),30.0,"บุคลากรใน รพ. และรพสต. มีศักยภาพในการดูแลผู้ป่วย HT, DM ครบวงจร ดูแลโรคเฉพาะทาง ด้านจิตเวช, wound care รวมทั้งดูแล improve nutrition ในกลุ่มโรคมะเร็งก่อนผ่าตัด ",12
สตูล,โรงพยาบาลควนโดน,KHUANDON HOSPITAL,11402,สำนักงานปลัดกระทรวงสาธารณสุข (สป.สธ.),โรงพยาบาลชุมชน(รพช.),30.0,,12
สตูล,โรงพยาบาลควนกาหลง,KHUANKALONG HOSPITAL,11403,สำนักงานปลัดกระทรวงสาธารณสุข (สป.สธ.),โรงพยาบาลชุมชน(รพช.),40.0,,12
สตูล,โรงพยาบาลท่าแพ,THAPHAE HOSPITAL,11404,สำนักงานปลัดกระทรวงสาธารณสุข (สป.สธ.),โรงพยาบาลชุมชน(รพช.),32.0,"1.	การส่งเสริม,ป้องกัน รักษาและฟื้นฟูโรคทั่วไประดับปฐมภูมิและทุติยภูมิระดับต้น<br />2.	การทำงานกับชุมชนและเครือข่าย  <br />3.	การบริหารจัดการแบบเครือข่ายในการดูแลโรคทางแม่และเด็กและโรคเรื้อรัง<br />4.	การทำงานที่สอดคล้องกับบริบทชุมชนและวิถีมุสลิม",12
สตูล,โรงพยาบาลละงู,LANGU HOSPITAL,11405,สำนักงานปลัดกระทรวงสาธารณสุข (สป.สธ.),โรงพยาบาลชุมชน(รพช.),60.0,การสร้างความร่วมมือกับชุมชน/เครือข่าย ,12
สตูล,โรงพยาบาลทุ่งหว้า,THUNGWA HOSPITAL,11406,สำนักงานปลัดกระทรวงสาธารณสุข (สป.สธ.),โรงพยาบาลชุมชน(รพช.),30.0,,12
ตรัง,โรงพยาบาลกันตัง,KANTANG HOSPITAL,11407,สำนักงานปลัดกระทรวงสาธารณสุข (สป.สธ.),โรงพยาบาลชุมชน(รพช.),77.0,"""1) การดูแลแบบเวชศาสตร์ครอบครัวโดยมีแพทย์เฉพาะทางสาขาเวชศาสตร์ครอบครัวเป็นหัวหน้าทีม โดยมีคลินิกหมอครอบครัว 5 ทีม<br />2) มีคลินิกเฉพาะโรคที่มีประสิทธิภาพ <br />3) ทันตแพทย์เฉพาะทาง ประกาศนียบัตรชั้นสูงสาขาศัลยกรรมช่องปากและแม็กซิลโลเฟเชียล และ ปริญญาโทสาขาทันตกรรมสำหรับเด็ก<br />4) มีการให้บริการแพทย์แผนไทยและแพทย์ทางเลือก<br />5) มีการดูแลผู้ป่วยระยะท้ายแบบประคับประคองแบบบูรณาการครอบคลุม กาย จิต สังคม และจิตวิญญาณ""",12
ตรัง,โรงพยาบาลย่านตาขาว,YANTAKHAO HOSPITAL,11408,สำนักงานปลัดกระทรวงสาธารณสุข (สป.สธ.),โรงพยาบาลชุมชน(รพช.),91.0,1.ด้านออร์โธปิดิกส์<br />2.ด้านสูตินรีเวช <br />3.ด้านกุมารเวช<br />4.ด้านเวชศาสต์ครอบครัว <br />5.ด้านทันตกรรม/จัดฟัน ,12
ตรัง,โรงพยาบาลปะเหลียน,PALIAN HOSPITAL,11409,สำนักงานปลัดกระทรวงสาธารณสุข (สป.สธ.),โรงพยาบาลชุมชน(รพช.),39.0,,12
ตรัง,โรงพยาบาลสิเกา,SIKAO HOSPITAL,11410,สำนักงานปลัดกระทรวงสาธารณสุข (สป.สธ.),โรงพยาบาลชุมชน(รพช.),60.0,,12
